{"authority":"non-authoritative-reviewed-static-control-data","control_revision":"15d99b55f4910df94decdd7edcc80bf95aee492d","directional_binding":"control-revision-g-describes-earlier-implementation-revision-h","implementation":{"revision":"c30e0d69ec374cd812ff361e670e974d51b661c4","selected_sources":[{"path":".github/workflows/stage2-prebuilt-local-kata-qualification.yml","sha256":"2ba561203f87f4bb2caa7c3924d463cb7368702bb5514cb4a277c360908fdaa8","size":43013},{"path":"config/stage2-completion-ssh-readiness-v1.json","sha256":"7e485e024c02b710ab6ca67123b5c0178a4253ec5c91dcbd218e4711f71b517f","size":736},{"path":"deploy/aws-feasibility/completion_campaign_evidence_issuer.py","sha256":"4a03607899e5f5dedde483c77fff19166edfcc256be713b994aec8ff5d7b16aa","size":32581},{"path":"deploy/aws-feasibility/completion_campaign_production.py","sha256":"79ea0c07b9f0e3a71a6b75be9f2a08a33dc838e92defb264694b9670a9bd5435","size":61027},{"path":"deploy/aws-feasibility/completion_campaign_remote_adapter.py","sha256":"5cd51abeaeb01143d4b5be6021358bfd3600f0cb66431b83bb873a7c5fbad745","size":20263},{"path":"deploy/aws-feasibility/remote/completion_cycle_authority.py","sha256":"750e9f3fd13ea0c515ceb5245b99cbeac134d5e1315198cf47042b01f9410cc8","size":3891},{"path":"deploy/aws-feasibility/remote/completion_cycle_evidence.py","sha256":"450ad0bde32b2557763c6dde69dbd58aab620c811d36a1ee22ff97d297a1eddd","size":29419},{"path":"deploy/aws-feasibility/remote/completion_cycle_full.py","sha256":"dad16dd938e5ca9c461192c742f7630169a19f89db74cc0fa12206797f2f94e6","size":1121},{"path":"deploy/aws-feasibility/remote/completion_cycle_full_rehearsal.py","sha256":"25468a68e97407a209d47429f154dfeabd21b7887781081c57ab21bcae3b2607","size":653},{"path":"deploy/aws-feasibility/remote/completion_cycle_readiness.py","sha256":"d5d07812d0d29da3368585b2aa52d5f6c5d1783040e098dabf80dad4b836fa62","size":1148},{"path":"deploy/aws-feasibility/remote/completion_cycle_readiness_rehearsal.py","sha256":"e346160a9be7043575fc470e54c8c9b651bf05536edd8edeacb121ae1f3b9587","size":668},{"path":"deploy/aws-feasibility/remote/completion_formal_cycle_authority.py","sha256":"27e4517edabbfff3a2f7a5b4b028595a917be03539277e98d39a5a278b54fb78","size":6643},{"path":"deploy/aws-feasibility/remote/completion_formal_cycle_full.py","sha256":"7b5fbad00318fd2dabf71e559bf32a89cea0ba305b215d68234124eedde629ea","size":1050},{"path":"deploy/aws-feasibility/remote/completion_formal_cycle_readiness.py","sha256":"5fc3c9e6392b1b110a374778e7f73bc57d8c4d043f7c5842b845c75145106830","size":1065},{"path":"deploy/aws-feasibility/remote/completion_guest_readiness_v1.py","sha256":"500423ea45a3c12da1eaf107281a966e88f21f77701524f2d8617d0456f68e4c","size":1521},{"path":"deploy/aws-feasibility/remote/completion_guest_workloads_v2.py","sha256":"723bf54ef1b9b1fe4670b1a0d82e6744a29d33fbd0dc2cad4b3cc88863dae406","size":33332},{"path":"deploy/aws-feasibility/remote/completion_guest_workloads_v3.py","sha256":"a134e1b00791b4cccf37206284f36dc685056f8a57aebc13173f09285292a35c","size":28517},{"path":"deploy/aws-feasibility/remote/completion_kata_actions.py","sha256":"81296735a1e0469f12a012c2ea31ce3749bb9a5ae36dd81294f2e0e71c08f475","size":4374},{"path":"deploy/aws-feasibility/remote/completion_kata_admission.py","sha256":"7556797e501d1d9a21dac14c95dbfc27cc7866ee1230037ae25cc177edf1ee19","size":73618},{"path":"deploy/aws-feasibility/remote/completion_kata_command_policy.py","sha256":"039d6d58fae8fef9b38fa9b2486d7324ea3cc59188800f8727d4306256a88f9e","size":16816},{"path":"deploy/aws-feasibility/remote/completion_kata_coordinator.py","sha256":"3dbb256466fc6c7621db8f34349b6a249f1de507f3eaa1f6e79e16496a1ef4d9","size":31196},{"path":"deploy/aws-feasibility/remote/completion_kata_execution_bridge.py","sha256":"631b1fec8bab50f2d3c39f0de4dc87f8781c0401c766c81ac1e9a8a51e133eb8","size":46033},{"path":"deploy/aws-feasibility/remote/completion_kata_fdmap.py","sha256":"dc50344f756725dd8904c0d849b6299742c26bb0d88731370c991ce2a38444df","size":13187},{"path":"deploy/aws-feasibility/remote/completion_kata_immutable_preparation.py","sha256":"535d676b3965c148f7d0816e459b39755a682b5ae18fdd1707d3110f0bd27e3c","size":57307},{"path":"deploy/aws-feasibility/remote/completion_kata_inputs.py","sha256":"5946766f2743a7060cbe0d3655e2d3e12b3f63e5f065cab8981a4e9e376aa8e7","size":109525},{"path":"deploy/aws-feasibility/remote/completion_kata_network.py","sha256":"850a72a5df7942d1999ee394b4e390b71d65e00c5e56e2a1f25b2371950e794d","size":194424},{"path":"deploy/aws-feasibility/remote/completion_kata_network_journal.py","sha256":"7702abe8c946d27a543baa96f45414b1852081b14cf10fdc99330cc297379108","size":45725},{"path":"deploy/aws-feasibility/remote/completion_kata_nft_owner.py","sha256":"40a87313a942cf0cbc0f95d10fc3bdc55198a5bbc5c0728f575aac2ef27ebc7b","size":37488},{"path":"deploy/aws-feasibility/remote/completion_kata_operation.py","sha256":"5597de44dffb20d9103aa0c2b97cbf1636b509ab6f3afcdf66eb34a9892a1e56","size":232608},{"path":"deploy/aws-feasibility/remote/completion_kata_operation_bridge.py","sha256":"6c87ad14a563b4587cd61b6a2a998f1d4ab292ae1f1321f6353d487306e7a35c","size":14571},{"path":"deploy/aws-feasibility/remote/completion_kata_preparation.py","sha256":"7c6d5a7b5b333c1d79fe2e371259664c3680e8b50c4f30bde5bdd0b924471488","size":86615},{"path":"deploy/aws-feasibility/remote/completion_kata_preparation_bridge.py","sha256":"899abfd6a5c038d35a62eba9839dd4f11567ce38ea73d050e16bdec5a4d512e5","size":12805},{"path":"deploy/aws-feasibility/remote/completion_kata_prestage_runtime.py","sha256":"730c4920d7cbdba59933e7157441dc402ac370531de7d1f471933945c19e75e7","size":10791},{"path":"deploy/aws-feasibility/remote/completion_kata_process.py","sha256":"859a3baf4c6cc56195153f58cfd7ae53ef85106726ee3f8c83ac8653df960061","size":123626},{"path":"deploy/aws-feasibility/remote/completion_kata_runtime.py","sha256":"1fd35f6aa8e248c19094a8bbaecc9e310a751b6a9e3ca3610f3fab9892557cbb","size":146273},{"path":"deploy/aws-feasibility/remote/completion_kata_ssh.py","sha256":"3fb573bcc1d29aa1f73aff2d52cc66c1fabb39d888d5fb80acfd3a7ad3b9d63b","size":23573},{"path":"deploy/aws-feasibility/remote/completion_local_evidence.py","sha256":"aaf2b733c8c86d47a661b27d117cd85faa594f24a09a91e189f0f978494e2300","size":46613},{"path":"deploy/aws-feasibility/remote/completion_local_full.py","sha256":"a1c445a2245c58f3d5cf0abab1a7f15da1e149157f204913c9e12ee4d7ab37bb","size":20110},{"path":"deploy/aws-feasibility/remote/completion_local_receipt.py","sha256":"55a0adf73900f8d53a588db8eb661303d6b9f7afbf9b58151382e72406643583","size":4208},{"path":"deploy/aws-feasibility/remote/completion_prebuilt_runtime_contract.py","sha256":"726404b4a754c3b6671aa375d7800749d62665fa8002c3fd50a7dbc3638a8488","size":1691},{"path":"deploy/aws-feasibility/remote/completion_rootfs_builder.py","sha256":"7aefbdde44fd4d26165c2324dda0fa68c4fb2bc9c5532a0702f9716414a2f57f","size":98128},{"path":"deploy/aws-feasibility/remote/completion_rootfs_canonical.py","sha256":"8adf9231bdc65ebed4e967806306327294d20e61183ef3d6404b35cfa9831603","size":8085},{"path":"deploy/aws-feasibility/remote/completion_rootfs_fs.py","sha256":"aa263f3d0868f5f953f4a65c0c34d9a4cc59223fb35e25436cb195b34f9edb16","size":37179},{"path":"deploy/aws-feasibility/remote/completion_rootfs_lease.py","sha256":"a6da0fd1848fdf82e404b50af01a6a51e74639a887be8d8ede528653ca871240","size":53331},{"path":"deploy/aws-feasibility/remote/completion_rootfs_ledger.py","sha256":"3241b5451ceeee3cae0ab3d9bd7f9b8073689501ce4fc1c40acbdc7b63279fe9","size":92864},{"path":"deploy/aws-feasibility/remote/completion_rootfs_materializer.py","sha256":"69320d8b620b03b3373a4dd00efe543af364b72490b26b477d7107b19b23c9de","size":39089},{"path":"deploy/aws-feasibility/remote/completion_rootfs_model.py","sha256":"5bb81f73c9d87307242440a5b5fb1a23411f3e35a91cd5135c63834d31462510","size":1554},{"path":"deploy/aws-feasibility/remote/completion_rootfs_prebuilt.py","sha256":"9fe7358a8c03bcbc24bf70b20a3ec64604c1ebec5457b24586610970a4ea345f","size":9921},{"path":"deploy/aws-feasibility/remote/completion_rootfs_prebuilt_acquisition.py","sha256":"71c5a809d102b0c91b9734f410a9d51edb04cf52fa41fce10616a37224567c19","size":16954},{"path":"deploy/aws-feasibility/remote/completion_runtime_closure.py","sha256":"a1f8bf8211fb269a5e4df48ba7e6c2b9eb5ab0132f68a4d098eebae1f4e63c25","size":11543},{"path":"deploy/aws-feasibility/remote/completion_runtime_contract.py","sha256":"3ed164fbdc0630c944b9f79a03c109080f3fbeb7d846ee6e83a4ebe7f22404af","size":31579},{"path":"deploy/aws-feasibility/remote/recover-stage2-completion-remote.sh","sha256":"cf95219fc5783086ddb31037c4e7661250303d5e39b876fd37e8313db74170f5","size":1746},{"path":"deploy/aws-feasibility/remote/run-stage2-completion-full-rehearsal.sh","sha256":"b17f79acedf290e35e8de4785a68a75b6898a9c6cd97175882dd17260118444b","size":779},{"path":"deploy/aws-feasibility/remote/run-stage2-completion-full.sh","sha256":"affb8692f09809a5acb6d69d0d8abb5daa6958788ee8d33e1c2ff6f6ede7e756","size":764},{"path":"deploy/aws-feasibility/remote/run-stage2-completion-readiness-rehearsal.sh","sha256":"dc9ed356092e97cd45689af19043efef070dae845678bb9b6ba04e1688adad92","size":789},{"path":"deploy/aws-feasibility/remote/run-stage2-completion-readiness.sh","sha256":"b8d79e82476d7f225888478abffdaf3f4a197d5c5c23cd80c9bfb8ad8590f197","size":786},{"path":"docs/security-evidence/kata-3.32.0-qmp-source-contract.json","sha256":"a111534bdb6bc28b9031eb9d635041e1b94183d4c191da404939665a4ddd02fe","size":1654},{"path":"schemas/aws-stage2-completion-evidence-v3.json","sha256":"5081e1cc745e2363ce1f0fb8a1db7fd1b0b7eebfdaf5326cfb35b1b7309ae3dc","size":22386},{"path":"schemas/aws-stage2-completion-production-approval-v5.json","sha256":"f6d1180e4053ecaea59da90fb87fe64ea23ccf9f2419a9a3caa1be5364511d7a","size":3689},{"path":"schemas/aws-stage2-production-evidence-upload-receipt-v2.json","sha256":"4234a4261a640dd31cc53c7c00c5a9a9ed60a86a4f210cd2a664a62f908889df","size":2296},{"path":"schemas/stage2-formal-local-artifact-custody-